{
  "材料信息": {
    "文档标题": "某半导体设备公司财报点评",
    "文档类型": "研报",
    "作者或发布主体": "某券商",
    "发布时间": "2025-04-28",
    "业务时间": "2025Q1",
    "来源位置": "第 3 页“订单与收入确认”部分",
    "来源形态": "用户提供片段",
    "来源可靠性": "中",
    "缺失字段": []
  },
  "本体化抽取": {
    "研究对象": [
      { "名称": "某半导体设备公司", "对象类型": "Company", "证据位置": "第 3 页“订单与收入确认”部分" },
      { "名称": "半导体设备", "对象类型": "Industry", "证据位置": "第 3 页“订单与收入确认”部分" },
      { "名称": "先进制程客户", "对象类型": "Segment", "证据位置": "第 3 页“订单与收入确认”部分" }
    ],
    "状态变量": [
      {
        "变量名称": "新签订单",
        "变量类型": "定量",
        "观测口径": "指定期间新签订单金额或同比变化；与在手订单、合同负债、出货和收入确认区分",
        "挂载对象": "某半导体设备公司",
        "适用范围": "先进制程客户订单",
        "候选状态": "可保留候选",
        "证据位置": "第 3 页“订单与收入确认”部分"
      },
      {
        "变量名称": "订单能见度",
        "变量类型": "定性",
        "观测口径": "订单对未来收入确认的覆盖程度，可通过合同负债、在手订单、发出商品、交付排期和验收节点观察",
        "挂载对象": "某半导体设备公司",
        "适用范围": "未来 2-3 个季度",
        "候选状态": "需专家校准",
        "证据位置": "第 3 页“订单与收入确认”部分"
      }
    ],
    "状态观测": [
      {
        "观测变量": "新签订单",
        "观测值": "2025Q1 新签订单同比增长 45%",
        "valueType": "actual",
        "observationTime": "2025Q1",
        "来源文档": "某半导体设备公司财报点评",
        "证据位置": "第 3 页“订单与收入确认”部分",
        "处理建议": "可作为观测候选"
      }
    ],
    "事件或触发": [
      {
        "标题": "2025Q1 新签订单同比高增长",
        "触发类型": "状态变化",
        "主体": "某半导体设备公司",
        "业务时间": "2025Q1",
        "来源": "某半导体设备公司财报点评",
        "证据位置": "第 3 页“订单与收入确认”部分",
        "候选状态": "Signal候选"
      }
    ],
    "传导逻辑": [
      {
        "来源变量": "新签订单",
        "目标变量": "收入确认节奏",
        "方向映射": "新签订单增长，未来收入确认概率提升",
        "预期时间窗口": "未来 2-3 个季度",
        "边界条件": "若交付延期或订单毛利率低于历史均值，传导减弱",
        "来源证据": "订单高增有望提升未来 2-3 个季度收入能见度",
        "证据位置": "第 3 页“订单与收入确认”部分",
        "置信度": "中"
      }
    ],
    "验证信号": [
      {
        "信号名称": "合同负债变化",
        "signalRole": "tracking",
        "观察对象": "合同负债",
        "关联变量": "订单能见度",
        "数据来源": "后续财报",
        "观察窗口": "未来 1-3 个季度",
        "预期方向": "合同负债维持或增加",
        "对模板的作用": "跟踪订单向收入确认传导是否仍有支撑",
        "证据位置": "第 3 页“订单与收入确认”部分",
        "置信度": "中"
      },
      {
        "信号名称": "发出商品和验收节点",
        "signalRole": "tracking",
        "观察对象": "发出商品、交付和验收披露",
        "关联变量": "收入确认节奏",
        "数据来源": "后续财报、公告或公司交流纪要",
        "观察窗口": "未来 1-3 个季度",
        "预期方向": "发出商品转收入确认，验收节点按期完成",
        "对模板的作用": "区分订单、出货和收入确认，验证设备交付链条",
        "证据位置": "第 3 页“订单与收入确认”部分",
        "置信度": "中"
      },
      {
        "信号名称": "毛利率变化",
        "signalRole": "weakening",
        "观察对象": "毛利率",
        "关联变量": "订单质量",
        "数据来源": "后续财报",
        "观察窗口": "未来 1-3 个季度",
        "预期方向": "若毛利率低于历史均值，削弱订单到利润传导",
        "对模板的作用": "识别订单增长是否以低质量订单为代价",
        "证据位置": "第 3 页“订单与收入确认”部分",
        "置信度": "中"
      }
    ],
    "阻断条件": [
      {
        "条件描述": "交付延期",
        "作用对象": "新签订单到收入确认节奏的状态假设",
        "signalRole": "blocking",
        "可观察改写": "订单交付或验收节点未在预期窗口完成",
        "阈值或窗口": "未来 2-3 个季度",
        "来源证据": "若交付延期，订单对利润的传导可能弱于预期",
        "当前状态": "候选",
        "证据位置": "第 3 页“订单与收入确认”部分"
      }
    ]
  },
  "表达类型区分": {
    "事实": ["2025Q1 新签订单同比增长 45%"],
    "预测": ["订单高增有望提升未来 2-3 个季度收入能见度"],
    "假设": ["订单能够按期交付并确认收入"],
    "判断": ["订单对利润存在正向传导可能"],
    "推荐语": []
  },
  "证据": [
    {
      "原文片段": "公司 2025Q1 新签订单同比增长 45%",
      "证据位置": "第 3 页“订单与收入确认”部分",
      "对应候选项": "新签订单",
      "来源文档": "某半导体设备公司财报点评"
    }
  ],
  "质量提示": [
    "该材料可作为订单能见度变量的候选证据。",
    "该材料为单一来源，不能直接升格为高置信通用模板。"
  ],
  "沉淀建议": [
    {
      "对象": "新签订单",
      "沉淀状态": "可保留候选",
      "原因": "具备时间、来源和明确观测值。"
    },
    {
      "对象": "订单增长到收入确认传导逻辑",
      "沉淀状态": "需补来源",
      "原因": "当前仅有单篇材料支持，需补充多来源和历史案例。"
    }
  ]
}
